{
  "id": "ed360496-e35f-4c71-9f05-e6c4ce843370",
  "parent_recording_id": "8c73cf3e-efc5-485b-91b0-7ba62f3985b5",
  "version": 7,
  "total_version_count": 7,
  "edit_instructions": "{\"ffmpegInstructions\": [{\"end\": 600, \"start\": 0}, {\"end\": 2400, \"start\": 1200}, {\"end\": 3955, \"start\": 2700}], \"requestedInstructions\": [{\"end\": 1200, \"start\": 600, \"reason\": \"Removing 10 minutes from version 1\", \"end_of_cut\": \"00:20:00\", \"start_of_cut\": \"00:10:00\"}, {\"end\": 2700, \"start\": 2400, \"reason\": \"Also removing 5 minutes from version 1\", \"end_of_cut\": \"00:45:00\", \"start_of_cut\": \"00:40:00\"}]}",
  "edit_requests": [],
  "filename": "ed360496-e35f-4c71-9f05-e6c4ce84_1280x720_4500k.mp4",
  "duration": "PT50M55.7S",
  "capture_session": {
    "id": "bb5ec935-5bb6-43ba-8ec5-241aba1d1b52",
    "booking_id": "15cfbbed-53bd-41b5-ab57-0962ab919f18",
    "origin": "PRE",
    "ingest_address": "rtmps://in-890f8537-c5d4-4b81-bb69-31fa36e21e26.uksouth.streaming.mediakind.com:2935/eca9b219-03c4-4e70-b768-c513122b859a",
    "live_output_url": "https://ep-default-live-pre-mediakind-stg.uksouth.streaming.mediakind.com/bb5ec9355bb643ba8ec5241aba1d1b52/index.qfm/manifest(format=m3u8-cmaf)",
    "started_at": "2025-05-27T08:55:58.931Z",
    "started_by_user_id": "f8750aa0-ecf3-ec11-bb3c-0022481b1f95",
    "finished_at": "2025-05-27T10:54:16.279Z",
    "finished_by_user_id": "f8750aa0-ecf3-ec11-bb3c-0022481b1f95",
    "status": "RECORDING_AVAILABLE",
    "court_name": "Leeds Youth",
    "case_state": "OPEN"
  },
  "created_at": "2025-08-26T11:09:49.447Z",
  "case_id": "eb0d9ede-6c96-4819-8d70-cdfc630e7c1f",
  "case_reference": "STG-AUTOEDIT2",
  "is_test_case": false,
  "participants": [
    {
      "id": "c5f269be-0d57-408d-9fde-51e0f221138e",
      "participant_type": "DEFENDANT",
      "first_name": "Test",
      "last_name": "Test2",
      "created_at": "2025-05-27T08:53:32.855Z",
      "modified_at": "2025-05-27T08:53:32.831Z"
    },
    {
      "id": "f442ca19-da72-4d23-a239-a27d6bb9b4c8",
      "participant_type": "WITNESS",
      "first_name": "Test2",
      "last_name": "",
      "created_at": "2025-05-27T08:53:32.851Z",
      "modified_at": "2025-05-27T08:53:32.825Z"
    }
  ]
}
